{
  "lote_id": "10000000-0000-4000-8000-000000000001",
  "status": "exito",
  "resumen_comunidad": {
    "total_interacciones_procesadas": 3,
    "total_descartadas": 0,
    "sentimiento_predominante": "positivo",
    "temas_principales": [
      "Empleabilidad",
      "Configuración",
      "Navegación"
    ]
  },
  "activos_distribucion_generados": {
    "post_linkedin": null,
    "destaque_newsletter_semanal": null,
    "sugerencia_contenido_faq": {
      "interaccion_id": "00000000-0000-4000-8000-000000000002",
      "tema": "Configuración",
      "origen": "#qa",
      "pregunta": "¿Dónde configuro la conexión?",
      "respuesta": "Consulta las variables de configuración del servicio. Respuesta ficticia de prueba.",
      "status": "BORRADOR"
    }
  },
  "interacciones_fallidas": [],
  "almacenamiento_oci": {
    "bucket": "qa-ficticio",
    "ruta_objeto": "mock://qa-ficticio/activos/revision/paquete.json",
    "status": "simulado"
  }
}
