{
  "lote_id": null,
  "status": "exito",
  "resumen_comunidad": {
    "total_interacciones_procesadas": 0,
    "total_descartadas": 3,
    "sentimiento_predominante": "Sin contenido válido",
    "temas_principales": []
  },
  "activos_distribucion_generados": null,
  "interacciones_fallidas": [],
  "almacenamiento_oci": null
}
